{
  "$schema": "http://json-schema.org/draft-07/schema#",
  "$id": "https://ccxt.com/schemas/edl.schema.json",
  "title": "CCXT Exchange Definition Language (EDL) Schema",
  "description": "Schema for defining cryptocurrency exchange integrations in CCXT",
  "type": "object",
  "required": ["exchange", "urls", "has", "auth", "api"],
  "properties": {
    "exchange": {
      "type": "object",
      "description": "Exchange metadata",
      "required": ["id", "name"],
      "properties": {
        "id": {
          "type": "string",
          "pattern": "^[a-z][a-z0-9_]*$",
          "description": "Unique exchange identifier (lowercase)"
        },
        "name": {
          "type": "string",
          "description": "Human-readable exchange name"
        },
        "countries": {
          "type": "array",
          "items": { "type": "string", "pattern": "^[A-Z]{2}$" },
          "description": "ISO 3166-1 alpha-2 country codes"
        },
        "version": {
          "type": "string",
          "description": "API version"
        },
        "rateLimit": {
          "type": "integer",
          "minimum": 0,
          "description": "Rate limit in milliseconds between requests"
        },
        "certified": {
          "type": "boolean",
          "default": false,
          "description": "Whether the exchange is CCXT-certified"
        },
        "pro": {
          "type": "boolean",
          "default": false,
          "description": "Whether this is a CCXT Pro exchange"
        },
        "alias": {
          "type": "boolean",
          "default": false,
          "description": "Whether this is an alias for another exchange"
        },
        "dex": {
          "type": "boolean",
          "default": false,
          "description": "Whether this is a decentralized exchange"
        }
      }
    },
    "urls": {
      "type": "object",
      "description": "URL configuration",
      "required": ["api", "www", "doc"],
      "properties": {
        "logo": { "type": "string", "format": "uri" },
        "api": {
          "oneOf": [
            { "type": "string", "format": "uri" },
            {
              "type": "object",
              "additionalProperties": { "type": "string", "format": "uri" }
            }
          ]
        },
        "test": {
          "type": "object",
          "additionalProperties": { "type": "string", "format": "uri" }
        },
        "www": { "type": "string", "format": "uri" },
        "doc": {
          "type": "array",
          "items": { "type": "string", "format": "uri" }
        },
        "fees": { "type": "string", "format": "uri" },
        "referral": { "type": "string", "format": "uri" }
      }
    },
    "has": {
      "type": "object",
      "description": "Exchange capabilities",
      "additionalProperties": {
        "oneOf": [
          { "type": "boolean" },
          { "type": "null" }
        ]
      }
    },
    "timeframes": {
      "type": "object",
      "description": "OHLCV timeframe mappings (CCXT key -> exchange value)",
      "additionalProperties": { "type": "string" }
    },
    "requiredCredentials": {
      "type": "object",
      "description": "Required authentication credentials",
      "properties": {
        "apiKey": { "type": "boolean", "default": true },
        "secret": { "type": "boolean", "default": true },
        "uid": { "type": "boolean", "default": false },
        "login": { "type": "boolean", "default": false },
        "password": { "type": "boolean", "default": false },
        "twofa": { "type": "boolean", "default": false },
        "privateKey": { "type": "boolean", "default": false },
        "walletAddress": { "type": "boolean", "default": false },
        "token": { "type": "boolean", "default": false }
      }
    },
    "auth": {
      "type": "object",
      "description": "Authentication configuration",
      "required": ["type"],
      "properties": {
        "type": {
          "type": "string",
          "enum": ["hmac", "jwt", "rsa", "eddsa", "apikey", "custom"]
        },
        "algorithm": {
          "type": "string",
          "enum": ["sha256", "sha384", "sha512", "md5", "sha1", "ES256", "ES384", "ES512", "RS256", "RS384", "RS512"]
        },
        "encoding": {
          "type": "string",
          "enum": ["base64", "base64url", "hex", "binary"]
        },
        "timestampUnit": {
          "type": "string",
          "enum": ["seconds", "milliseconds", "microseconds", "nanoseconds"]
        },
        "nonceType": {
          "type": "string",
          "enum": ["timestamp", "incrementing", "uuid"]
        },
        "signatureFormat": { "type": "string" },
        "signature": {
          "type": "object",
          "properties": {
            "components": {
              "type": "array",
              "items": {
                "type": "string",
                "enum": ["path", "method", "timestamp", "nonce", "body", "body_urlencoded", "body_json", "body_hash", "query", "querystring", "host"]
              }
            }
          }
        },
        "headers": {
          "type": "object",
          "additionalProperties": { "type": "string" }
        },
        "body": {
          "type": "object",
          "additionalProperties": { "type": "string" }
        },
        "query": {
          "type": "object",
          "additionalProperties": { "type": "string" }
        }
      }
    },
    "api": {
      "type": "object",
      "description": "API endpoint definitions",
      "properties": {
        "public": { "$ref": "#/definitions/apiCategory" },
        "private": { "$ref": "#/definitions/apiCategory" }
      }
    },
    "parsers": {
      "type": "object",
      "description": "Response parser definitions",
      "additionalProperties": { "$ref": "#/definitions/parserDef" }
    },
    "errors": {
      "type": "object",
      "description": "Error pattern definitions",
      "properties": {
        "patterns": {
          "type": "array",
          "items": { "$ref": "#/definitions/errorPattern" }
        }
      }
    },
    "fees": {
      "type": "object",
      "description": "Fee configuration",
      "properties": {
        "trading": {
          "type": "object",
          "properties": {
            "tierBased": { "type": "boolean" },
            "percentage": { "type": "boolean" },
            "taker": { "type": "number" },
            "maker": { "type": "number" },
            "tiers": {
              "type": "object",
              "properties": {
                "taker": { "type": "array" },
                "maker": { "type": "array" }
              }
            }
          }
        }
      }
    },
    "limits": {
      "type": "object",
      "properties": {
        "amount": { "$ref": "#/definitions/minMax" },
        "price": { "$ref": "#/definitions/minMax" },
        "cost": { "$ref": "#/definitions/minMax" },
        "leverage": { "$ref": "#/definitions/minMax" }
      }
    },
    "precision": {
      "type": "object",
      "properties": {
        "amount": { "type": "integer" },
        "price": { "type": "integer" },
        "base": { "type": "integer" },
        "quote": { "type": "integer" }
      }
    },
    "options": {
      "type": "object",
      "additionalProperties": { "type": "string" }
    },
    "overrides": {
      "type": "array",
      "items": {
        "type": "object",
        "required": ["method", "file"],
        "properties": {
          "method": { "type": "string" },
          "description": { "type": "string" },
          "file": { "type": "string" }
        }
      }
    }
  },
  "definitions": {
    "apiCategory": {
      "type": "object",
      "properties": {
        "get": { "$ref": "#/definitions/endpointGroup" },
        "post": { "$ref": "#/definitions/endpointGroup" },
        "put": { "$ref": "#/definitions/endpointGroup" },
        "delete": { "$ref": "#/definitions/endpointGroup" },
        "patch": { "$ref": "#/definitions/endpointGroup" }
      }
    },
    "endpointGroup": {
      "type": "object",
      "additionalProperties": {
        "type": "object",
        "properties": {
          "cost": { "type": "number" },
          "noSymbol": { "type": "number" },
          "byLimit": {
            "type": "array",
            "items": {
              "type": "array",
              "items": { "type": "number" }
            }
          },
          "params": {
            "type": "object",
            "additionalProperties": { "$ref": "#/definitions/paramDef" }
          }
        }
      }
    },
    "paramDef": {
      "type": "object",
      "properties": {
        "type": {
          "type": "string",
          "enum": ["string", "int", "integer", "float", "number", "bool", "boolean", "timestamp", "timestamp_ms", "timestamp_ns", "object"]
        },
        "required": { "type": "boolean" },
        "required_if": { "type": "string" },
        "default": { "type": "string" },
        "description": { "type": "string" }
      }
    },
    "parserDef": {
      "type": "object",
      "required": ["source"],
      "properties": {
        "source": { "type": "string" },
        "path": { "type": ["string", "null"] },
        "fallback": {
          "type": "array",
          "items": { "type": "string" }
        },
        "iterator": {
          "type": "string",
          "enum": ["array", "entries", "values"]
        },
        "mapping": {
          "type": "object",
          "additionalProperties": { "$ref": "#/definitions/fieldMapping" }
        }
      }
    },
    "fieldMapping": {
      "oneOf": [
        { "type": "string" },
        {
          "type": "object",
          "properties": {
            "path": { "type": "string" },
            "fallback": { "type": "array", "items": { "type": "string" } },
            "transform": { "type": "string" },
            "compute": { "type": "string" },
            "dependencies": { "type": "array", "items": { "type": "string" } },
            "from_context": { "type": "string" },
            "literal": { "type": "string" },
            "map": { "type": "object" },
            "default": { "type": "string" }
          }
        }
      ]
    },
    "errorPattern": {
      "type": "object",
      "required": ["match", "type"],
      "properties": {
        "match": { "type": "string" },
        "type": {
          "type": "string",
          "enum": [
            "ExchangeError", "AuthenticationError", "PermissionDenied",
            "InsufficientFunds", "InvalidOrder", "OrderNotFound",
            "CancelPending", "NetworkError", "RateLimitExceeded",
            "ExchangeNotAvailable", "InvalidNonce", "BadRequest",
            "BadResponse", "NullResponse", "NotSupported", "OnMaintenance",
            "AccountSuspended", "InvalidAddress", "AddressPending",
            "ArgumentsRequired", "BadSymbol", "MarginModeAlreadySet"
          ]
        },
        "retry": {
          "type": "string",
          "enum": ["none", "linear", "exponential"]
        },
        "message": { "type": "string" }
      }
    },
    "minMax": {
      "type": "object",
      "properties": {
        "min": { "type": ["number", "null"] },
        "max": { "type": ["number", "null"] }
      }
    }
  }
}
